{
  "schemaVersion": "calls-1.1.0",
  "generatedAt": "2026-08-31T12:00:00Z",
  "status": "ready",
  "registryVersion": "calls-registry-2.0.0",
  "closingWindowDays": 30,
  "counts": { "totalStored": 1, "active": 1, "open": 1, "closingSoon": 0, "expired": 0, "unverified": 0 },
  "sourceStatus": [
    {
      "sourceKey": "contract-conference",
      "sourceName": "Contract Conference",
      "officialUrl": "https://conference.invalid/call",
      "status": "verified",
      "checkedAt": "2026-08-31T11:50:00Z",
      "lastVerifiedAt": "2026-08-31T11:50:00Z",
      "httpStatus": 200,
      "foundCount": 1,
      "agendaSignalCount": 1,
      "attempts": 1,
      "latencyMs": 20,
      "rateLimitEvents": 0,
      "message": null,
      "parserVersion": "call-parser-1.0.0",
      "sourceVersion": "call-source-1.0.0",
      "sourceContentHash": "aaaaaaaaaaaaaaaaaaaaaaaaaaaaaaaaaaaaaaaaaaaaaaaaaaaaaaaaaaaaaaaa"
    }
  ],
  "items": [
    {
      "id": "call-valid-001",
      "sourceRecordId": "contract-conference:001",
      "title": "Contract validation call",
      "venue": "Contract Conference",
      "callType": "conference",
      "organizer": "Contract Conference",
      "description": "Call record used by automated contract tests.",
      "officialUrl": "https://conference.invalid/call",
      "opensAt": "2026-08-01T00:00:00Z",
      "deadlineAt": "2026-10-15T23:59:00Z",
      "deadlineTimezone": "not-specified",
      "eventDate": "2027-02-10",
      "topics": ["human–AI interaction"],
      "status": "open",
      "createdAt": "2026-08-31T11:50:00Z",
      "lastCheckedAt": "2026-08-31T11:50:00Z",
      "lastVerifiedAt": "2026-08-31T11:50:00Z",
      "parserVersion": "call-parser-1.0.0",
      "sourceVersion": "call-source-1.0.0",
      "sourceKey": "contract-conference",
      "sourceKeys": ["contract-conference"],
      "sourceName": "Contract Conference",
      "contentHash": "bbbbbbbbbbbbbbbbbbbbbbbbbbbbbbbbbbbbbbbbbbbbbbbbbbbbbbbbbbbbbbbb",
      "versions": [
        {
          "version": 1,
          "contentHash": "bbbbbbbbbbbbbbbbbbbbbbbbbbbbbbbbbbbbbbbbbbbbbbbbbbbbbbbbbbbbbbbb",
          "observedAt": "2026-08-31T11:50:00Z",
          "title": "Contract validation call",
          "description": "Call record used by automated contract tests.",
          "officialUrl": "https://conference.invalid/call",
          "deadlineAt": "2026-10-15T23:59:00Z",
          "eventDate": "2027-02-10",
          "topics": ["human–AI interaction"]
        }
      ]
    }
  ]
}
